data,liga,jogo,aposta,odd,stake,resultado,lucro
2026-02-09,Friendlies Women,Scotland U17 W x Morocco U17 W,Mais de 1.5 gols,1.8,100,PENDENTE,0
2026-02-09,Paraibano,Serra Branca x Nacional de Patos,Mais de 1.5 gols,1.8,100,PENDENTE,0
2026-02-09,Liga MX Femenil,León W x Necaxa W,Mais de 1.5 gols,1.8,100,PENDENTE,0
2026-02-09,Premier League,Weymouth Wales x Brittons Hill,Mais de 1.5 gols,1.8,100,PENDENTE,0
2026-02-09,Premier Division,Garden Stars x Old Road,Mais de 1.5 gols,1.8,100,PENDENTE,0
2026-02-09,Primera División,Sporting San Jose x Guadalupe FC,Mais de 1.5 gols,1.8,100,PENDENTE,0
